### ISSUE TITLE
http task 发起post请求报errorno 104

### ISSUE THREAD

**Issue by henryw2019** [sogou/workflow#1238]
我使用http task写了个客户端，计划实现定时向服务端发起post请求，代码主体如下:
```` c++
task = WFTaskFactory::create_http_task(url,1,0,task_callback);
req = task->get_req();
req->add_header_pair("Accept","*/*");
req->add_header_pair("Content-Type","text/xml");
req->set_method("POST");
req->append_output_body("…报文内容……");
series = Workflow::create_series_work(task,callback);
pwork->add_series(series);
````

运行后，task->get_state() 值为 1，task->get_error()值为 104。
 同样的报文内容，我使用curl命令发起post请求，可以得到正确返回。
请问我的代码哪里使用有问题吗，应该如何改进？

**Comment by Barenboim** [comment]
这个是Connection reset by peer。你可以用tcpdump抓一下请求和回复。我感觉是server的问题，server觉得你Header里提供的信息太少，觉得你是spider就把你关了。你可以自己用workflow搭个server看看收到的内容正不正确。

**Comment by henryw2019** [comment]
服务端也是自己本机的系统，没有防spider。

从tcpdump抓包看，服务端正常处理了业务，先是返回处理结果报文，客户端ack后 ，服务端主动发起了FIN 关闭链接，客户端也答复了FIN。

对比Workflow服务端抓包结果，workflow服务端不会主动发起FIN，而是由客户端等待约3秒后发起FIN。

为什么完成业务报文返回后，服务端主动断开链接，在客户端会报104呢，看抓包业务的返回报文已经发给客户端了。感觉可以算是一次正确的通讯过程呀。

**Comment by Barenboim** [comment]
https://github.com/sogou/workflow/issues/782
你是不是用的一年多前的代码？我们还真修复过一个类似问题。

**Comment by henryw2019** [comment]
哈哈，我用的Workflow代码还真是好久没更新了，我更新了试试。

**Comment by henryw2019** [comment]
试了一下最新Workflow的master分支代码，还是报104 。

调试发现代码进了 HttpTaskImpl.cc 335行的if，但338-341的if判断并没有进入(其中resp->is_keep_alive 值为1 ，其他都是0)，好像resp 并没有获取到返回内容，我打印resp->get_status_code(),结果显示为 null。

从Tcpdump抓包结果来看，服务端返回了业务响应报文后，客户端ack，然后服务端再发起FIN 断开链接，客户端应该是收到了报文的。

**Comment by Barenboim** [comment]
你把完整的server response贴一下吧。应该好查的。如果说is_keep_alive是1，说明我们没有匹配上Connection这个header。

**Comment by henryw2019** [comment]
抓包结果如下：

```
tcpdump: verbose output suppressed, use -y or -vv for full protocol decode
listening on lo, link-type EN1OMB_ (Ethernet), capture size 262144 bytes
14:00:34.188173 IP localhost.55178 > localhost. 9112: Flags [S], seq 3294108774, win 43690, options [mss 65495, nop, nop, sackOK, nop, wscale 7], length 0

14:00:34.188199 IP localhost. 9112 > localhost.55178: Flags [S.], seq 2223784793, ack 3294108775, win 43690, options [mss 65495, nop, nop, sackOK, nop, wscale 7],length 0

14:00:34.188213 IP localhost.55178  > localhost.9112: Flags[.] ack 1, win 342,length 0

14:00:34.219232 IP localhost.55178 > localhost.9112: Flags[P.], seq 1:218, ack 1,win 342,length 217

14:00:34.219251 IP localhost.9112 > localhost.55178 Flags[.] ack 218, win 350,length 0

14:00:35.232475 IP localhost.9112 > localhost.55178 Flags[P.], seq 1:989,ack 218, win 350, length 988
 
14:00:35.232498 IP localhost. 55178  localhost. 9112: Flags [.],ack 989, win 357, length 0

14:00:35.233126 IP localhost.9112 > localhost.55178: Flags [F.], seq 989, ack 218, win 350, length 0

14:00:35.234032 IP localhost. 55178  localhost. 9112: Flags [F.] seq 218, ack 990, win 357, length 0

14:00:35.234055 IP localhost.9112 > localhost.55178: Flags [.] ack 219, win 350, length 0
```

**Comment by Barenboim** [comment]
应该是这个Date:之后没有内容的原因吧。http协议里，header是可以写在多行上的，我怀疑这么写无法表示一个空的header。

**Comment by Barenboim** [comment]
考虑到workflow也可以发空header。我们还是兼容一下这种情况吧。

**Comment by henryw2019** [comment]
> 应该是这个Date:之后没有内容的原因吧。http协议里，header是可以写在多行上的，我怀疑这么写无法表示一个空的header。
> 你的http server是自制的？

我去掉了回复中的Date内容，还是报104😅，is_keep_alive值依然是1。如果我在check_response()中把this->state、this->error 都赋值为0，resp->get_paser_body()还是拿不到返回内容，感觉is_keep_alive匹配上了可能还是有问题。

服务端是自制的，有点老了

**Comment by Barenboim** [comment]
我给你算了一下字节数，你这个http server换行用的好像是\n。http协议是\r\n。你这个我们不做兼容的。

**Comment by Barenboim** [comment]
改成\r\n之后，Data: 后面为空也是对的是吧？

**Comment by henryw2019** [comment]
> 改成\r\n之后，Data: 后面为空也是对的是吧？

改了以后，Date: 后面为空也是对的。

**Comment by Barenboim** [comment]
好的。那我们的解析应该没有什么问题！
