### ISSUE TITLE
centos7下http服务端收到http请求解析异常

### ISSUE THREAD

**Issue by xiaoshizijiayou** [sogou/workflow#1161]
在window下用的http服务端处理http请求正常，由于系统需要迁移到centos,测试发现同样的请求发到centos7下http服务端收到http请求解析异常，如下图，请及时给解答下，谢谢！
![image](https://user-images.githubusercontent.com/26808449/217458244-b18927f2-7494-4d85-8f3f-e12c56538383.png)
![image](https://user-images.githubusercontent.com/26808449/217458356-8f7c41bb-d5ee-4540-a48d-64c681812c6c.png)

**Comment by xiaoshizijiayou** [comment]
workflow的库是在centos7下编译的，gcc用的10版本，openssl用的1.02k版本，可以运行，但是servertask异常

**Comment by Barenboim** [comment]
你好。centos下是运行时错误，还是编译错误？用的版本时0.10.5或master最新代码吗？

**Comment by Barenboim** [comment]
我看是调用feedback函数出问题？

**Comment by xiaoshizijiayou** [comment]
> 你好。centos下是运行时错误，还是编译错误？用的版本时0.10.5或master最新代码吗？

可以正常运行，运行时出的错，截图是调试时的内存数据，用git拉取的最新版本编译的库，然后在工程里使用的

**Comment by xiaoshizijiayou** [comment]
> 我看是调用feedback函数出问题？

截图是服务运行时，有http请求推送上来，severtask数据是异常的

**Comment by Barenboim** [comment]
我不太明白你的意思。是说程序没有挂，但server收到的数据和client发的不一样？

**Comment by Barenboim** [comment]
你是https server吗？
windows版是不是用的WFHttpsServer类，而Linux版是用WFHttpServer类？

**Comment by xiaoshizijiayou** [comment]
> 我不太明白你的意思。是说程序没有挂，但server收到的数据和client发的不一样？

不是，我的意思是：处理发送的http请求不都是在process()函数里进行吗，同样的http服务端，在windows下处理请求正常，在centos下异常

**Comment by xiaoshizijiayou** [comment]
> 我不太明白你的意思。是说程序没有挂，但server收到的数据和client发的不一样？

不是，我的意思是：处理发送的http请求不都是在process()函数里进行吗，同样的http服务端，在windows下处理请求正常，在centos下异常

**Comment by xiaoshizijiayou** [comment]
> 你是https server吗？ windows版是不是用的WFHttpsServer类，而Linux版是用WFHttpServer类？

不是https，都是http服务，用的一套接口，直接从windows迁移到centos的

**Comment by Barenboim** [comment]
centos下怎么个异常法？server可以运行到 process，但看到的request内容不一样吗？

**Comment by xiaoshizijiayou** [comment]
> centos下怎么个异常法？server可以运行到 process，但看到的request内容不一样吗？
是，请再仔细看下上面发的两张截图

**Comment by Barenboim** [comment]
我实在很难从你的那两个图里分析出太多信息。
大概知道你是用curl发了一个POST请求，POST内容比较大，curl发送了一个Expect: 100-continue的http头。这种情况下我们的server应该会自动回复一个HTTP/1.1 100 Continue，然后继续接受请求。我自己在Linux上重复这一过程，没有找到什么问题。能不能把你的curl命令发一下？

**Comment by xiaoshizijiayou** [comment]
> 我实在很难从你的那两个图里分析出太多信息。 大概知道你是用curl发了一个POST请求，POST内容比较大，curl发送了一个Expect: 100-continue的http头。这种情况下我们的server应该会自动回复一个HTTP/1.1 100 Continue，然后继续接受请求。我自己在Linux上重复这一过程，没有找到什么问题。能不能把你的curl命令发一下？

我写了一个libcurl的客户端测试程序，用的post方法，以下为发送的数据内容：
{
   "group_id" : "group_repeat",
   "image" : "/9j/4AAQSkZJRgABAQAAAQABAAD/2wBDAAIBAQEBAQIBAQECAgICAgQDAgICAgUEBAMEBgUGBgYFBgYGBwkIBgcJBwYGCAsICQoKCgoKBggLDAsKDAkKCgr/2wBDAQICAgICAgUDAwUKBwYHCgoKCgoKCgoKCgoKCgoKCgoKCgoKCgoKCgoKCgoKCgoKCgoKCgoKCgoKCgoKCgoKCgr/wAARCACWAH0DASIAAhEBAxEB/8QAHwAAAQUBAQEBAQEAAAAAAAAAAAECAwQFBgcICQoL/8QAtRAAAgEDAwIEAwUFBAQAAAF9AQIDAAQRBRIhMUEGE1FhByJxFDKBkaEII0KxwRVS0fAkM2JyggkKFhcYGRolJicoKSo0NTY3ODk6Q0RFRkdISUpTVFVWV1hZWmNkZWZnaGlqc3R1dnd4eXqDhIWGh4iJipKTlJWWl5iZmqKjpKWmp6ipqrKztLW2t7i5usLDxMXGx8jJytLT1NXW19jZ2uHi4+Tl5ufo6erx8vP09fb3+Pn6/8QAHwEAAwEBAQEBAQEBAQAAAAAAAAECAwQFBgcICQoL/8QAtREAAgECBAQDBAcFBAQAAQJ3AAECAxEEBSExBhJBUQdhcRMiMoEIFEKRobHBCSMzUvAVYnLRChYkNOEl8RcYGRomJygpKjU2Nzg5OkNERUZHSElKU1RVVldYWVpjZGVmZ2hpanN0dXZ3eHl6goOEhYaHiImKkpOUlZaXmJmaoqOkpaanqKmqsrO0tba3uLm6wsPExcbHyMnK0tPU1dbX2Nna4uPk5ebn6Onq8vP09fb3+Pn6/9oADAMBAAIRAxEAPwD4n+L/AO142l3lz4X8AWQmuEYqbhh8qEHHNeA+M/HfivxddtJ4h1qe53HiEkhFHsKpwILRWuZ/mkOSxwTvJOck55qTTNGn1eVDCrMX6YGa7pSpU1dbGcKVSpLljuUUtL2bCRq2f9rmp7Xw7qN6QYbNwT1xXpHhbwBbRwq9yoDgAkNzjNdHF4ZsbZGWO2UD2WvMqZpytqCPoMPkUpU05vc8r034e6nNJm4zsIycL/WtD/hAoo8Mynha9JfTYguUTacY4HH5Usei21wuGULznmuCWYVG7noU8kordHnVn8PbcSbmUgr98MOlaVh4Q0+2mBaLKem3FduuhRtgIz7e5NI2kRYwgz6DbWMsfUfU6Y5Nh4NNI4i68CWsrmQRIN3dh0qrJ8OrbySqod+fldRjH4V6IugHYwYcH7uVzmpBoSr++2nOOwqfr01szT+x6dm3FHm3/Cv4oINscn7wDP3MZ/nWbrHgbUUiN3DCTzg98V6+2hosanHQ5yeaaNLhij8sRq2Rz8uc1tTzKomtTjq5HScW7WPIvhp8S/GXwU8XJ4l8O3csW8bby3z8sq+nt9a+9f2ePjz4e+OPhVdY0ycx3MA8u6tnkUFW+lfGvj3wRa6jA11GgjkT7pWqP7OnxW1j4IfFS31Bbx1sbudYNRQuwBJON3U49a9ejVhiad47nzGMwksJP3j9HinBYjg9KeNoGCufrVXQ76LV9Ngv7eQOksYdGB4IPSrbJz8q/rUKnfdnI7o/K26H2nbbwx4XuRXbfDjSYIEXKrvcZwKw7LR2Q+csJwxwoZc13/w30p5Zd7gjIwSy4rDHVH7Ns93KIc2JWmhtWFvJHIqFeNgySM5xV/7HvUxqnymtAaWbcq0yggjAIq+tq90PLt7bJ9lrwW02faJ8qOXl2xKwKEhfbrUQuIEYSbOD2YV2g8BzyWnnOhzjO7FZy+CU80tJIMn1HSspVILQ6KVLnlczLeMPEQpxkZ6UogiRQTNyvXDZz+lbQ8OSRJhccjA281BLodwuQgOD3VKwVS8t9DtnRcYqyMh72NZsMhyvQYqUIJWIVXCjpg9a39L8ES3jLuh3N3INbVl8K7ieXy44XBUZJJ/pRKsiVBJXkzjYbTeoVV4HtUc1oqAbsAnstd/qXw9n0+PzpYtq+qise80AEfcX5epAxURq2ldEyhCpGyZw+racJoG6njO31ryDxpo6yXkjtEF+Y7sDGARj/wCvX0ZP4V+1wnyhIABjd1zXkvxG0a40nWJo5YipYcFRwR617+T4lOq4o+O4jw/IlLp/wx9RfsOfETUvHfwqjstVkDS6a4gLZyWwFK/T736V7aIx3AH0r5F/4J3a7eWHiHXfDKEm2mEcoUdiABkfX+lfX8SkrwuPxr2z42ek9D89/C+gxGD7PJHvxhUVuu417x8Pvgdc2vhAavfWIR5BkKy9Pxqn+y98KR498Zia+iX7NZCOaRm6DOcfyNfSXjXxX8K9B0k6XqPirT4gsZREEiqd4OCNrEN+lfP4ypVqVHCEbpbn1WCdLCRUr6s+cNQ8LzOXaOH6/J976c1X063WwlXzZ1RR1DVrePPiP4d+0mLw0ZpwBwyR4H4HtXnXiA+L9aZp7XQLxY2GV+Vv8KIYS/8AEdjueY127QX4HoV9400hbf7HFNEDjHUVTjv7C4bMUqt+VeWP4R8W7/Pn0e6bH3ioJxV6zu7rRJFOoWNzGy/eLIcUquDoSj7r19TowuYV6NRe0VkesabYafJEHaMfOM4Udf8ACnSaDbTXG+GNh6YFcLp3j+z85ITqOwYwwkbZn6V23hvxNpV5MqSajDuHfdwa8ipg6tLWzPoaWNpVYXU196Os8P6do2j27S3KpkDPNOPj7R9GuZbswrIMY4PT9K5rxnrGlWsSpcavFGw5WMSYc/UVzUPjHw3Kg3QXE+OhjirWhhqj1cWzgxVei1ZTXyZ1uu/F7SL1zC+g3BVmxn5Rj8Kzjs1Hy7my09ih/wBYhHNZ1pr1sbkRWPgm5lO7Cu6A598Yrs9DvNYuZRFD4BuUby8OccfyrepT5fd5Fr5r/M85Xoe9zmVBpcDAm3hdMjLbx97/AArjfi98LIPEuiTXltCVuIE3qQOGT69q930nVdLNrs17wRfWzon7zfb5x+XWsbWrn4e3Dsuma8m4cyWk3DKPcdqyo08Th6ynFfcXicbhMRQdOt20PCv2F4obH4w3tlK80fmWBQAd3UkY/Xr7V9nwIpT7v5c18gfASGbwf+0bLBEg2XAkjiQ9SCw5H6/lX2BbCN4Q/Iz2zX2ULyimz89klzP1PA/2c/Edv4b+G+txxW8st9cW+62aFM4IIGSenGG4zzmvIf2b/Asdj4wuNY8eaSJrm2Lbku4Ru3/KxPPPIZfz9q+gP2JPh/ofxQ8HXPiK5uZ4DZyvEIYiQUAABG04HOSeldH45+DOn6VrLHTLYhpCS07jOXIA6/QYr52eLhGUqcV17n02HwXvRnJ6nE2MZ8U+IlBt0gtIskJbpgcVJ4t1rw1pG6w/tKONEGBufAz6df6VYtPB3i2eeTSdElS3llBHnkfdz7f/AF68s8XfBjUNA8Sy3fijW3vbjduDyEkZ+ma517CU/fZ7vsJ25qe5rSeP9K06RppNQAizhelLqXxA8EeLdIkttsZnj+6TGDn/AL5zXJeOvDVxr/hkaLazCDEiMZI4hu47Z96xvCHw4stAuYtRkvbppkPKAfKfyIrthSwULSi3c86pLOFP95Fcp2tj8P8Awt410OeDULFUEn+rlVMFPXB7Yrjrb4UQp4ii0JdduFj8zaZUkPT1rovEOvan4e0XyNEbKSHcxDcj1HStXwVoWq6xYx3158krqxViOcDoayx+LqUKSlFrU7sry2jjq0nVjt5Gl4d+AunaBb3LW9w2oyuvyNeMXAOM+v0HWsJHls5mjEcabDhlRNp9+Pauo8MHxvF4purHULopZxWZwScEuGj5/nWde+ELi01hp7hpTHPJuSXrn1H40qWMpunrrc0jQnOUowjy28jM1HxfJ4ato9VvJyEeQKW3+vftXQab8ctW0GBNYt1kurZ5fLUoPmQYzlsZqzdfAS08eabBbX1sZoA6u4V+vt7V3fgb4C+DvDuitpj6QyQbs+VvJB4xzmpq4rBKHK4annzwOPlX/eVLrsWPDnxR1/WLKHWNB06Scvy6Y/TkGuH+Muk6n4l8RW2tx+F3sLqW0KyLBbbi7A452Zr1Lw1a2PheRdO03T/KRX5HpXc2f2PW9YtjcxpKwtS26RASpJJzz+H51lhsdSpNuCMcblM217SWh83aJ4O0rUvi3ovjSGV1ji0xFuJHGzbPnJBGePvH8q95t7qJYwpfp0I715p8bPhtY2HxX1rxXqE9wltp+mRTC0hYpGJGBO4gdeoGK6/wbHfyeE9O/tKYLcG0RpgefmYA4/DpX0GAxscRLlS2PHzDK54SiqvNo/8Agf5nW/st6LBpT6zBbwQxrdhbjbGgA5ODjHupFdN8U9BvP7DludLhV5E/eABc5Ncz+ytK7xxqk6yxfYMxyf30YI4/EMXz6Yr1bxJ9nksHtnXKldp3V8ZGfv6n1eLpxpYmUIu6T0Pneyvbyyd7nUtHmTd99kTdXIeP5NDvrj7ZKkhZhnLx4r3PXIBbQG3t03Z77eteY+OPDk97dtNLbAB+Quz/ADitK9VKOiOnBxlz/FY8purbTrgtDb2kYB/2elQroNidwaIy8YwEz+tdre6BFZAqLQDH+xWTea5ZaWC0luxBIAWNME5qKGJctIo9OvhZyWrOd0/wW2s6jsFuWXdyMcLXplloFtZC3tbeBVKhBtPp6dK6zwD4c0Z9IhuLCzV7m7Adspng1r6v4Bv7e6ikmVXD4wsL5PGP8a48bOpOGux35d7GjLllozz/AMZeC7yGNNctYmbbguo6kA5I/GqEcekajbHT7mxnMeMoyp/WvZkg0+w082msWp2gYYbMsaoa14d8CXxRLYC2kZQIyB8pz9M1nSqzUE0TiJRdTnt9x5XpV5L4fvgNOvHSIEEqydMfjXbR+MdLubUQOT5n+yKxNe8Ly2uqeVHOWP8ACRyBWv4V8FT+ak7xSOT2NaqvKb1Ry16MUuZsZDDLcSedYWTud/yu3Sut+HGh6rHq39qascuV2hAOAvHH6Cui8LeGoEgRVthtzkqeBXVDQrWKyAijEUg7quc10UYSctDyMXXjJcjPK/jX4RXxdq2raBbSOn2+ztDKV4by1OW/lj8Pesq5t42uHWKPaqthQq9u1ej+NtB1Dw/rX9vzw5a/0FY4mkHGd24n8gPz964+LSpggCjgeuOa+1yfDezpcz0bPjc3xcqzjSWyv+h5V/wSn+KNx4y8Nah4R1S/WW60p1EKsCXK/Ng8ZwCCc564r6t8RJ5kZgZlwa5v4V/8EbtX/Yw8XeJPi94C+J13d6Np8RiudH8RtHJcBFmkiHzxqqxvjacPuB3KoYudtdD4inCbZwoKlc4xXyuPhGFdyitGfRZbVWMoprdaM5u805Az7sYXoSKxNXsNJWVp5hnIwQy1P4m8SNAJGhDbicCuO1jXpzKyNL8g/wBrNeXVxigrH0VDL5fEzJ8VrauXMcWFBxgL/WvH/ELwa74+svDFm3loZ08w9MDvzXpHifVHmjeO3LltvA965/wn8NLt7yXXp4yJ5MtEVTlc9Oc1WDmmpNvW2h61WHsaaTPXdG1nwX8MoI7VdRR7po1WMFx0xnABNUI/iLJL4gW+ctJsbcqY7cf4V89/GX9nL44/EPxbbalpWqolvFgxzLdlCuBj7vf866Hwz4L+O3g7RQniDW7S7gtMK0jn94wP8Wf6V1VsNTVOMlU1tsedCo3Ub5b36n01rHjHwLq+kjUfFKxWaADdOW2A57A1yPxV07SofDKXvhXUjco8iuCjj5VxngjFc342+DGg/GnwFYpeavfQTxosm+2uimX9xium8B+CI9K8NJ4a1jUZrlEhCIJsHGBjriuNUKfLdPU09pGkrvY4/wAM6/JfXPk3TqXJwCetexeDLG3k0mMyo2B3xzXkGs+Ar7w9rRFsm6NjlWQ8iu98D+Jb+GBbe7ZgwOPm4zSi4wlqycdSVaHNTZ6ZpNjGFDKOD61tWkLFlyqsirk7jgfTNcxpOuRzY5IbGa6PStSjuLqG1AyXIDAjjn2rvwtWHtEj57G0aipSb7HuGs/sPfFz9on4f6BqXwzuPDNpDp6fZrqfXdRnha4KqisUWK3lyAyAckcqw96r2H/BI/8AaKMR+3eP/BMDZ4SGW+lH5mJf5V9H/sc+N9R+0v8ADW8hkaGbw5ba9CxXP2d5ZpInjJ7btiSDPJPmHGME++7COAR+PNfcU5SjBJHwLi5u9z5s/ai+BGp6j8J9e034avrlrdX8cMstrqmsxy2d1K1xFKY3e8bcrO8Sguj5Bxu4NfAPjxL/AEy3ns9RtZLS5tZmt7q0mUb4ZlYqyHBIyGVh1wcZ7181fED/AIKbftr/ABAgmtNe+OdyltcOjXNnpem29msioQVjMkSCXYCqnaXKlhkgmvZ/BvjC1+IXw1sdYiuGd5LfE3mOSS+c5OeSeeSTk818vxBhZ4elGUl32+R9VwxW56soJ9nb8zl/EGpvcPlGYAHOcZzXKXk6yybpHwe/auq1u1KStbjOR0rBuNHV1aXc+4+tfF1Vd2ufpFNw5UY6LZxyiS5Vdu7nPpXXeHtf0ZbBTAUOBhRnrXmfxQkvNI0qSWBmyI8gIOprz/wP+0jpdhcSaRcaNqE80fCiKNSCfTOa9XB4arUgpU9fmcWKxlNVeSadz6q05JdZwYodiMMKTUHiTwz/AKE9q4DlmAyOuB6183+Iv2lvjX4sRtD8D+BtRtkH8ZCQk/i5GKj0bVP2otMnF1Ppc8yynLP/AGzA6j6/MCPyrtqZdNx5nJX9R4WHtJ2advQ+l9A0yfSrOOCCYAFB8hxxit2K1l0uz+2XVmxXOQQvBr5qHhf45eLb6N7jVXspJTnLXoAT/vnNdjoehfGvw7bNFJ49e5A+7aSiNo//AEGsoYdwV3JXKxuCcdnodh4g+Jvh671v+zm2NJnBVsZj9M4J61rWNvFfBZrZzleWr508S6J8W/C3xCOt+Kmtbq2uTmJ7WELs9N5HpXu/wk8QQa3YLNIGLqMD2rkxcFSd07nLSU/ZarU7fTHVcIEwQMZ211fh1hEBqNwOIsNnHYVz1jDGZRKX+UjNa8Op6ZZxONRkZYI4t0vPRO/5UYGcfrMU9zix6/2aVz9S/wBljwbp/hX4G+G76O2X+0NY0KxvNTuiv7yaV4EIDE8kICEGOMDpkk16VX40/Cb/AIOBPjV4N8Unwn4r8F6D408M6XqD20EkjyWOpyRR/JzMu+GYggYzECcfer6x8P8A/Bf39jjVdPjuNW8C+PdNnMStJBPY2DLuI5CMLz5wCCM4HTpX6Qm+VM/MveUnc/Dlr6F5i/mhsp2Fe3fse/F+C01Gf4d6tebUlXfa7zkZzjGfxb8/avnQXflqQATg9VFS6brd7o2qwavpt0YZ7Z98TIcYbOfy9q6Mwwccdh3Re5OAxVTAYj2sdtvvPvTxVorSyG5jXp1x6VxerXKW8bESkexNanwI+LNt8YfAEN3dOovrZPKvU5yGzj09f5g96PGOiGNWeIMyj1WvzbEYB06jW1j9MwebOdONzz/XYE1yRbaRmdT229a0fDngXQ9Ksme10yNJQM52DJPrmp9P0ad7oSYIUnDEjFdfZaVa+SFMinIwRXlupKh7qZ9DTlCslJpNnmnirVr/AEaJ4raBo0/jeNcH9DXn2qeN9UiuHubXVrkOv3lM3X6nrX0g3gLSNTBecqwfsUzn9aqf8KP8CzFlvLJGZ/vEBR/Suqlj1Fe8ja86esJNHhvgXx9rZ1AR3FzNtJwGMrcfka968C3I1WNAxOMZJIpdO+AXgOBAtvaouDlfl5P610ejeC7Pw4v+jyjGMDmorVVN8xhUxEqkbTu2Z/jHQLLVtKmtbuxVl8vAYDGa5n4f6HD4fvJIrdnCNJlRurv79lmhNvn5CMdKxxpsFlIdkYyDkY7VyVKsq2jMoyhTjqbNrdqAGkbbhOp6V5Z+1r8aV8A/DWbStLuHXU9XAgtAD/CfvNn8DXcy3jeV5c0xCBfmbb90etfFX7QvxLb4i/Eq6uba4kazsT9mtQWypA+8QO3T9Pevo+HcIq2Lc57RX4vb8j5PiPHSo4S0XrJ/gt/zOR07U5oJPLDE4xn5s5weh7YI4PHvmt6x8Z6lbQ+Ul5OMHoCMep656kk/jXKjcAVJC/7pqRRIR8z/AExX3TgpNXPgHVkm7npXhP8AZk/aY8eCM+Cv2e/FtysnMctzphso3HbD3RjXn61t61+xL8bfCEQPj7W/CugXDlRHpcuqTXt2c46raQSxDr/z07V+osmrTeEPBNz4i1C8MslvYGR5ix6AZB618veAfhxFqSzfFvxmrX/iXxE73c15duZDBC7lkgTcTgBSOO9TmGOdCNorVkZHha2aSlJu0Y7/ANM8u/ZU+AHxG+GXil9avfE1rcaddw7Z7VLB4yTjGeZD29uwPavXvEGlPHM8EbB1zjDV6F4W8MxQ7bh0y4Tq+f8AGsTxbYPa3UrIgOX6gdK+QzirJy9ptc+7y/DRpQ5E27HnQs47SXzp4sKTnGOlNv5YoUMlqDtPoK2NXMUqN8uD6kVyWvJd26NJa3JG3tt614MYRraS3PahXnhtUx2o+LpbGNUhc7h0XPIrIvfiFqCs0fmsS33VArE1fVbve8YgViOjqvNULM6leXDObYKU+6SM1t/ZtHlvcpZ5XbtY7nw/491C4uEMkkg7Bj6+mK7LTNdvtSCrMwGOwWvLNM0vWGlVlG0jnJfHPrXZaIt3bRL9ouyQ3ZRyK5KtCjTjozaOPxFTodhNexwoV3hyOu2qbt5x6n5uwqilxbBAsKg/32rV0ixe4lG5cAdOOtcSd3ZF2k9ZHG/HfULjwl8EPFPiy2dklttOYQPn+NzhRXwZD5JRco7HaQHYdc9c/r+dfff7ZPgvX/E/7Plx4Q8LlFvL69t5Nskm0MsbxsVyufcZr4g8WfCr4j+CNGl8S+IPDsqadBgXl/bSebDbk8Yk4Bi5wMsApzgEniv0PhuVCOAUE1zLVrqfA8SKtLGc80+Xp2MqB/m5YfL1yvWpU+bOGxj1NU4Zi4R4nDAdOcf/AF/6e9SfaDEgEfy8kHEZIP0Ir6ZttWPm2oN3Z+y/x8WSP4C639mk2FNCcAj2gP8AUVwOi28Q0bTERQAbGDjHpHGB+OO/vRRXh5x8UX5s9Xg1L6lU9Tq9ChQpux17elYXjfT4XWQjg5zwKKK+fzNKVLU+yw2k9DyvxLaSwyMPNzj04rjNbvplXl+vtRRXgwbjPQ9OtCLp6o5bUtSKuCY92Tj5qlstQZdxCUUV6Mm3A82nCLnsa9hey5Dls47EVs2N1JI5AY8UUV4eInPa57lGEUlZG94fszcsXkcZ78da7nQbCNFUnt6CiiuanrF/I0qaoyvi1bl7G2jdsqC/HTGfpisL9j3TVvPjX40lkRJLCHR7KymsZeUlMoZySv3SMFVPHO3kEcUUV9Tw/wC7mkrfys+R4xlL/V6L688f1JPjb+wh+y7r3iaG8svhvFosmpZWUeH52skRmz+8WOIhAwx6bfavi39p39nDX/2bPGkXhmXxHBrVjeI8unXbPJDOEBAKyqAVzkjBBOfaiivu6Tbimz8yoVJtpN+f3n//2Q==",
   "image_type" : "BASE64",
   "liveness_control" : "LOW",
   "quality_control" : "NORMAL",
   "user_id" : "CCF5F99784AA7A9E",
   "user_info" : "B949DE57FD7A9CA9"
}

**Comment by Barenboim** [comment]
能不能抓一下包，看看实际发送的Http header？按理这个post不应该有问题。

**Comment by xiaoshizijiayou** [comment]
> 能不能抓一下包，看看实际发送的Http header？按理这个post不应该有问题。

我抓下试试，我用的一个测试程序，发送的请求一样，windows就正常，centos就异常

**Comment by Barenboim** [comment]
> > 能不能抓一下包，看看实际发送的Http header？按理这个post不应该有问题。
> 
> 我抓下试试，我用的一个测试程序，发送的请求一样，windows就正常，centos就异常

这就是最奇怪的地方……这两段代码在windows下和linux下是完全一致的。

**Comment by xiaoshizijiayou** [comment]
> > > 能不能抓一下包，看看实际发送的Http header？按理这个post不应该有问题。
> > 
> > 
> > 我抓下试试，我用的一个测试程序，发送的请求一样，windows就正常，centos就异常
> 
> 这就是最奇怪的地方……这两段代码在windows下和linux下是完全一致的。

[test.zip](https://github.com/sogou/workflow/files/10683520/test.zip)
这是测试客户端，您可以下载运行试下，应该直接运行exe就行

**Comment by xiaoshizijiayou** [comment]
> > > > 能不能抓一下包，看看实际发送的Http header？按理这个post不应该有问题。
> > > 
> > > 
> > > 我抓下试试，我用的一个测试程序，发送的请求一样，windows就正常，centos就异常
> > 
> > 
> > 这就是最奇怪的地方……这两段代码在windows下和linux下是完全一致的。
> 
> [test.zip](https://github.com/sogou/workflow/files/10683520/test.zip) 这是测试客户端，您可以下载运行试下，应该直接运行exe就行

访问的地址是：http://127.0.0.1:9906/register

**Comment by Barenboim** [comment]
你的curl程序还是一个windows下的exe？这样我没有办法在Linux下实验啊。而且我这边直接运行windows可执行程序也会受到限制。其实最好就是从你那上边看看发出去的http请求长什么样。
另外，这个问题有点过于奇怪。你也可以检查一下，Linux环境是不是有一些头文件不一致之类的问题。

**Comment by xiaoshizijiayou** [comment]
> 你的curl程序还是一个windows下的exe？这样我没有办法在Linux下实验啊。而且我这边直接运行windows可执行程序也会受到限制。其实最好就是从你那上边看看发出去的http请求长什么样。 另外，这个问题有点过于奇怪。你也可以检查一下，Linux环境是不是有一些头文件不一致之类的问题。

我抓包了，同样客户端http请求，用windows的服务，可以抓到包信息，分多个包发的；用centos的服务，抓不到包

**Comment by Barenboim** [comment]
你把HTTP header发给我看一下啊……如果你确定header是一样的话。

**Comment by xiaoshizijiayou** [comment]
> 你把HTTP header发给我看一下啊……如果你确定header是一样的话。

一样的，用的同样的客户端发的请求
![image](https://user-images.githubusercontent.com/26808449/217588496-e2be27b5-4b98-406f-8e10-303df0f7de2f.png)

**Comment by Barenboim** [comment]
你应该尽可能的给我完整的信息（在不泄漏敏感数据的前提下），否则我查起来很累。比如你这个截图里，第一行就是不完整的，我看不出你的request uri是否有问题，也看不见HTTP版本号。所以只能各种猜。
不过，这个POST请求看起来不会有什么问题。我今天也重新试了一下带Expect的POST请求，都是正常的。而且这里的处理，linux和windows代码完全一样。
你尽量找一个干净的Linux环境，或者把请求打到我们示例里的http echo server，看看能不能正常返会内容。

**Comment by xiaoshizijiayou** [comment]
> 你应该尽可能的给我完整的信息（在不泄漏敏感数据的前提下），否则我查起来很累。比如你这个截图里，第一行就是不完整的，我看不出你的request uri是否有问题，也看不见HTTP版本号。所以只能各种猜。 不过，这个POST请求看起来不会有什么问题。我今天也重新试了一下带Expect的POST请求，都是正常的。而且这里的处理，linux和windows代码完全一样。 你尽量找一个干净的Linux环境，或者把请求打到我们示例里的http echo server，看看能不能正常返会内容。

辛苦，大晚上还在回复问题！我拷贝了抓取的所有内容，请看下，我也再按您说的试下

Frame 1156: 9816 bytes on wire (78528 bits), 9816 bytes captured (78528 bits) on interface \Device\NPF_Loopback, id 0
    Section number: 1
    Interface id: 0 (\Device\NPF_Loopback)
        Interface name: \Device\NPF_Loopback
    Encapsulation type: NULL/Loopback (15)
    Arrival Time: Feb  9, 2023 00:15:55.982963000 中国标准时间
    [Time shift for this packet: 0.000000000 seconds]
    Epoch Time: 1675872955.982963000 seconds
    [Time delta from previous captured frame: 0.000250000 seconds]
    [Time delta from previous displayed frame: 0.000250000 seconds]
    [Time since reference or first frame: 15.520877000 seconds]
    Frame Number: 1156
    Frame Length: 9816 bytes (78528 bits)
    Capture Length: 9816 bytes (78528 bits)
    [Frame is marked: False]
    [Frame is ignored: False]
    [Protocols in frame: null:ip:tcp:http:urlencoded-form]
    [Coloring Rule Name: HTTP]
    [Coloring Rule String: http || tcp.port == 80 || http2]
Null/Loopback
    Family: IP (2)
Internet Protocol Version 4, Src: 127.0.0.1, Dst: 127.0.0.1
    0100 .... = Version: 4
    .... 0101 = Header Length: 20 bytes (5)
    Differentiated Services Field: 0x00 (DSCP: CS0, ECN: Not-ECT)
        0000 00.. = Differentiated Services Codepoint: Default (0)
        .... ..00 = Explicit Congestion Notification: Not ECN-Capable Transport (0)
    Total Length: 9812
    Identification: 0xaccf (44239)
    010. .... = Flags: 0x2, Don't fragment
        0... .... = Reserved bit: Not set
        .1.. .... = Don't fragment: Set
        ..0. .... = More fragments: Not set
    ...0 0000 0000 0000 = Fragment Offset: 0
    Time to Live: 64
    Protocol: TCP (6)
    Header Checksum: 0x0000 [validation disabled]
    [Header checksum status: Unverified]
    Source Address: 127.0.0.1
    Destination Address: 127.0.0.1
Transmission Control Protocol, Src Port: 2274, Dst Port: 9906, Seq: 284, Ack: 26, Len: 9772
    Source Port: 2274
    Destination Port: 9906
    [Stream index: 65]
    [Conversation completeness: Complete, WITH_DATA (31)]
    [TCP Segment Len: 9772]
    Sequence Number: 284    (relative sequence number)
    Sequence Number (raw): 285526948
    [Next Sequence Number: 10056    (relative sequence number)]
    Acknowledgment Number: 26    (relative ack number)
    Acknowledgment number (raw): 4172441401
    0101 .... = Header Length: 20 bytes (5)
    Flags: 0x018 (PSH, ACK)
        000. .... .... = Reserved: Not set
        ...0 .... .... = Accurate ECN: Not set
        .... 0... .... = Congestion Window Reduced: Not set
        .... .0.. .... = ECN-Echo: Not set
        .... ..0. .... = Urgent: Not set
        .... ...1 .... = Acknowledgment: Set
        .... .... 1... = Push: Set
        .... .... .0.. = Reset: Not set
        .... .... ..0. = Syn: Not set
        .... .... ...0 = Fin: Not set
        [TCP Flags: ·······AP···]
    Window: 10233
    [Calculated window size: 2619648]
    [Window size scaling factor: 256]
    Checksum: 0xab38 [unverified]
    [Checksum Status: Unverified]
    Urgent Pointer: 0
    [Timestamps]
        [Time since first frame in this TCP stream: 0.017062000 seconds]
        [Time since previous frame in this TCP stream: 0.000250000 seconds]
    [SEQ/ACK analysis]
        [iRTT: 0.000350000 seconds]
        [Bytes in flight: 9772]
        [Bytes sent since last PSH flag: 9772]
    TCP payload (9772 bytes)
    TCP segment data (9772 bytes)
[2 Reassembled TCP Segments (10055 bytes): #1152(283), #1156(9772)]
    [Frame: 1152, payload: 0-282 (283 bytes)]
    [Frame: 1156, payload: 283-10054 (9772 bytes)]
    [Segment count: 2]
    [Reassembled TCP length: 10055]
    [Reassembled TCP Data: 504f5354202f72656769737465723f6163636573735f746f6b656e3d32342e3834363738…]
Hypertext Transfer Protocol
    POST /register?access_token=24.84678b4a74ea1fdece915fa46c8ed724.2592000.1678464957.282335-16051294&aipSdk=C&aipSdkVersion=0.7.4&charset=UTF-8& HTTP/1.1\r\n
        [Expert Info (Chat/Sequence): POST /register?access_token=24.84678b4a74ea1fdece915fa46c8ed724.2592000.1678464957.282335-16051294&aipSdk=C&aipSdkVersion=0.7.4&charset=UTF-8& HTTP/1.1\r\n]
            [POST /register?access_token=24.84678b4a74ea1fdece915fa46c8ed724.2592000.1678464957.282335-16051294&aipSdk=C&aipSdkVersion=0.7.4&charset=UTF-8& HTTP/1.1\r\n]
            [Severity level: Chat]
            [Group: Sequence]
        Request Method: POST
        Request URI: /register?access_token=24.84678b4a74ea1fdece915fa46c8ed724.2592000.1678464957.282335-16051294&aipSdk=C&aipSdkVersion=0.7.4&charset=UTF-8&
            Request URI Path: /register
            Request URI Query: access_token=24.84678b4a74ea1fdece915fa46c8ed724.2592000.1678464957.282335-16051294&aipSdk=C&aipSdkVersion=0.7.4&charset=UTF-8&
                Request URI Query Parameter: access_token=24.84678b4a74ea1fdece915fa46c8ed724.2592000.1678464957.282335-16051294
                Request URI Query Parameter: aipSdk=C
                Request URI Query Parameter: aipSdkVersion=0.7.4
                Request URI Query Parameter: charset=UTF-8
        Request Version: HTTP/1.1
    Host: 127.0.0.1:9906\r\n
    Accept: */*\r\n
    Content-Length: 9772\r\n
        [Content length: 9772]
    Content-Type: application/x-www-form-urlencoded\r\n
    Expect: 100-continue\r\n
    \r\n
    [Full request URI: http://127.0.0.1:9906/register?access_token=24.84678b4a74ea1fdece915fa46c8ed724.2592000.1678464957.282335-16051294&aipSdk=C&aipSdkVersion=0.7.4&charset=UTF-8&]
    [HTTP request 2/2]
    [Response in frame: 1158]
    File Data: 9772 bytes
HTML Form URL Encoded: application/x-www-form-urlencoded
    Form item: "{
   "group_id" : "group_repeat",
   "image" : "/9j/4AAQSkZJRgABAQAAAQABAAD/2wBDAAIBAQEBAQIBAQECAgICAgQDAgICAgUEBAMEBgUGBgYFBgYGBwkIBgcJBwYGCAsICQoKCgoKBggLDAsKDAkKCgr/2wBDAQICAgICAgUDAwUKBwYHCgoKCgoKCgoKCgoKCgoKCgoKCgoKCgoKCgo
        Key [truncated]: {\n   "group_id" : "group_repeat",\n   "image" : "/9j/4AAQSkZJRgABAQAAAQABAAD/2wBDAAIBAQEBAQIBAQECAgICAgQDAgICAgUEBAMEBgUGBgYFBgYGBwkIBgcJBwYGCAsICQoKCgoKBggLDAsKDAkKCgr/2wBDAQICAgICAgUDAwUKBwYHCgoKCgoKCgoKCgoKCgoKCgoKCgo
        Value: =",\n   "image_type" : "BASE64",\n   "liveness_control" : "LOW",\n   "quality_control" : "NORMAL",\n   "user_id" : "CCF5F99784AA7A9E",\n   "user_info" : "B949DE57FD7A9CA9"\n}\n

**Comment by xiaoshizijiayou** [comment]
> 你应该尽可能的给我完整的信息（在不泄漏敏感数据的前提下），否则我查起来很累。比如你这个截图里，第一行就是不完整的，我看不出你的request uri是否有问题，也看不见HTTP版本号。所以只能各种猜。 不过，这个POST请求看起来不会有什么问题。我今天也重新试了一下带Expect的POST请求，都是正常的。而且这里的处理，linux和windows代码完全一样。 你尽量找一个干净的Linux环境，或者把请求打到我们示例里的http echo server，看看能不能正常返会内容。

以下图是用例子在linux编译运行echoserver接收到的数据，也是一样的问题：
![image](https://user-images.githubusercontent.com/26808449/217703337-fce085a1-63c0-49d3-b5e7-a504580e6038.png)

**Comment by kedixa** [comment]
这里提到的Centos 7环境是在windows下安装的一个虚拟机吗

**Comment by kedixa** [comment]
或者留个QQ什么的联系方式，我们远程看一下

**Comment by xiaoshizijiayou** [comment]
> 这里提到的Centos 7环境是在windows下安装的一个虚拟机吗

是的，用vs2015编写调试的Linux程序

**Comment by xiaoshizijiayou** [comment]
> 或者留个QQ什么的联系方式，我们远程看一下

QQ：2449327258

**Comment by kedixa** [comment]
@xiaoshizijiayou 这个问题解决后请回复并关闭issue，有别的问题再开新issue

**Comment by Barenboim** [comment]
问题已为用户查明是安装多个不同版本g++编译器引起。
